[
  {
    "alpha": 0.05,
    "benchmark_model_id": null,
    "evaluated_at": "2026-09-03T18:33:21.147373Z",
    "evaluator_version": "pycsep-0.8.0",
    "forecast_id": "etas-mizrahi-nepal-himalaya-20240917T000000Z-30d",
    "model_id": "etas-mizrahi",
    "n_simulations": null,
    "n_target_events": 0,
    "notes": "{\"seed\": 20220101, \"target_filter\": {\"below_threshold\": 3, \"given\": 4, \"no_mw\": 1, \"not_earthquake\": 0, \"outside_grid\": 0, \"used\": 0}}; forecast_total=0.6181; two-sided at alpha/2",
    "p_value": null,
    "passed": true,
    "quantile": null,
    "quantile_high": 1.0,
    "quantile_low": 0.5389504120936904,
    "statistic": 0.0,
    "target_catalog_hash": "e8e26a06c345c3f89eb9edd3f3d9d67d214eb73f84ff2b93b0fd0262e5ddc83f",
    "target_window_end": "2024-10-17T00:00:00Z",
    "target_window_start": "2024-09-17T00:00:00Z",
    "test_name": "N"
  },
  {
    "alpha": 0.05,
    "benchmark_model_id": null,
    "evaluated_at": "2026-09-03T18:33:21.147373Z",
    "evaluator_version": "pycsep-0.8.0",
    "forecast_id": "etas-mizrahi-nepal-himalaya-20240917T000000Z-30d",
    "model_id": "etas-mizrahi",
    "n_simulations": 1000,
    "n_target_events": 0,
    "notes": "{\"seed\": 20220101, \"target_filter\": {\"below_threshold\": 3, \"given\": 4, \"no_mw\": 1, \"not_earthquake\": 0, \"outside_grid\": 0, \"used\": 0}}; no target events: statistic undefined, N-test only",
    "p_value": null,
    "passed": null,
    "quantile": null,
    "quantile_high": null,
    "quantile_low": null,
    "statistic": 0.0,
    "target_catalog_hash": "e8e26a06c345c3f89eb9edd3f3d9d67d214eb73f84ff2b93b0fd0262e5ddc83f",
    "target_window_end": "2024-10-17T00:00:00Z",
    "target_window_start": "2024-09-17T00:00:00Z",
    "test_name": "M"
  },
  {
    "alpha": 0.05,
    "benchmark_model_id": null,
    "evaluated_at": "2026-09-03T18:33:21.147373Z",
    "evaluator_version": "pycsep-0.8.0",
    "forecast_id": "etas-mizrahi-nepal-himalaya-20240917T000000Z-30d",
    "model_id": "etas-mizrahi",
    "n_simulations": 1000,
    "n_target_events": 0,
    "notes": "{\"seed\": 20220101, \"target_filter\": {\"below_threshold\": 3, \"given\": 4, \"no_mw\": 1, \"not_earthquake\": 0, \"outside_grid\": 0, \"used\": 0}}; no target events: statistic undefined, N-test only",
    "p_value": null,
    "passed": null,
    "quantile": null,
    "quantile_high": null,
    "quantile_low": null,
    "statistic": 0.0,
    "target_catalog_hash": "e8e26a06c345c3f89eb9edd3f3d9d67d214eb73f84ff2b93b0fd0262e5ddc83f",
    "target_window_end": "2024-10-17T00:00:00Z",
    "target_window_start": "2024-09-17T00:00:00Z",
    "test_name": "S"
  },
  {
    "alpha": 0.05,
    "benchmark_model_id": null,
    "evaluated_at": "2026-09-03T18:33:21.147373Z",
    "evaluator_version": "pycsep-0.8.0",
    "forecast_id": "etas-mizrahi-nepal-himalaya-20240917T000000Z-30d",
    "model_id": "etas-mizrahi",
    "n_simulations": 1000,
    "n_target_events": 0,
    "notes": "{\"seed\": 20220101, \"target_filter\": {\"below_threshold\": 3, \"given\": 4, \"no_mw\": 1, \"not_earthquake\": 0, \"outside_grid\": 0, \"used\": 0}}; no target events: statistic undefined, N-test only",
    "p_value": null,
    "passed": null,
    "quantile": null,
    "quantile_high": null,
    "quantile_low": null,
    "statistic": 0.0,
    "target_catalog_hash": "e8e26a06c345c3f89eb9edd3f3d9d67d214eb73f84ff2b93b0fd0262e5ddc83f",
    "target_window_end": "2024-10-17T00:00:00Z",
    "target_window_start": "2024-09-17T00:00:00Z",
    "test_name": "L"
  },
  {
    "alpha": 0.05,
    "benchmark_model_id": null,
    "evaluated_at": "2026-09-03T18:33:21.147373Z",
    "evaluator_version": "pycsep-0.8.0",
    "forecast_id": "etas-mizrahi-nepal-himalaya-20240917T000000Z-30d",
    "model_id": "etas-mizrahi",
    "n_simulations": 1000,
    "n_target_events": 0,
    "notes": "{\"seed\": 20220101, \"target_filter\": {\"below_threshold\": 3, \"given\": 4, \"no_mw\": 1, \"not_earthquake\": 0, \"outside_grid\": 0, \"used\": 0}}; no target events: statistic undefined, N-test only",
    "p_value": null,
    "passed": null,
    "quantile": null,
    "quantile_high": null,
    "quantile_low": null,
    "statistic": 0.0,
    "target_catalog_hash": "e8e26a06c345c3f89eb9edd3f3d9d67d214eb73f84ff2b93b0fd0262e5ddc83f",
    "target_window_end": "2024-10-17T00:00:00Z",
    "target_window_start": "2024-09-17T00:00:00Z",
    "test_name": "CL"
  }
]
