[
  {
    "alpha": 0.05,
    "benchmark_model_id": null,
    "evaluated_at": "2026-09-03T17:16:25.818507Z",
    "evaluator_version": "pycsep-0.8.0",
    "forecast_id": "etas-mizrahi-turkiye-eaf-20220829T000000Z-30d",
    "model_id": "etas-mizrahi",
    "n_simulations": null,
    "n_target_events": 1,
    "notes": "{\"seed\": 20220101, \"target_filter\": {\"below_threshold\": 0, \"given\": 3, \"no_mw\": 2, \"not_earthquake\": 0, \"outside_grid\": 0, \"used\": 1}}; forecast_total=0.4531; two-sided at alpha/2",
    "p_value": null,
    "passed": true,
    "quantile": null,
    "quantile_high": 0.3643194471012956,
    "quantile_low": 0.9236814229787057,
    "statistic": 1.0,
    "target_catalog_hash": "6ae73920d22883505cc072fe1457ad64c4e1e0787671438b943ba2b73fb7cf26",
    "target_window_end": "2022-09-28T00:00:00Z",
    "target_window_start": "2022-08-29T00:00:00Z",
    "test_name": "N"
  },
  {
    "alpha": 0.05,
    "benchmark_model_id": null,
    "evaluated_at": "2026-09-03T17:16:25.818507Z",
    "evaluator_version": "pycsep-0.8.0",
    "forecast_id": "etas-mizrahi-turkiye-eaf-20220829T000000Z-30d",
    "model_id": "etas-mizrahi",
    "n_simulations": 1000,
    "n_target_events": 1,
    "notes": "{\"seed\": 20220101, \"target_filter\": {\"below_threshold\": 0, \"given\": 3, \"no_mw\": 2, \"not_earthquake\": 0, \"outside_grid\": 0, \"used\": 1}}",
    "p_value": null,
    "passed": true,
    "quantile": 0.548,
    "quantile_high": null,
    "quantile_low": null,
    "statistic": -3.295172955518305,
    "target_catalog_hash": "6ae73920d22883505cc072fe1457ad64c4e1e0787671438b943ba2b73fb7cf26",
    "target_window_end": "2022-09-28T00:00:00Z",
    "target_window_start": "2022-08-29T00:00:00Z",
    "test_name": "M"
  },
  {
    "alpha": 0.05,
    "benchmark_model_id": null,
    "evaluated_at": "2026-09-03T17:16:25.818507Z",
    "evaluator_version": "pycsep-0.8.0",
    "forecast_id": "etas-mizrahi-turkiye-eaf-20220829T000000Z-30d",
    "model_id": "etas-mizrahi",
    "n_simulations": 1000,
    "n_target_events": 1,
    "notes": "{\"seed\": 20220101, \"target_filter\": {\"below_threshold\": 0, \"given\": 3, \"no_mw\": 2, \"not_earthquake\": 0, \"outside_grid\": 0, \"used\": 1}}",
    "p_value": null,
    "passed": true,
    "quantile": 0.331,
    "quantile_high": null,
    "quantile_low": null,
    "statistic": -7.425216487940524,
    "target_catalog_hash": "6ae73920d22883505cc072fe1457ad64c4e1e0787671438b943ba2b73fb7cf26",
    "target_window_end": "2022-09-28T00:00:00Z",
    "target_window_start": "2022-08-29T00:00:00Z",
    "test_name": "S"
  },
  {
    "alpha": 0.05,
    "benchmark_model_id": null,
    "evaluated_at": "2026-09-03T17:16:25.818507Z",
    "evaluator_version": "pycsep-0.8.0",
    "forecast_id": "etas-mizrahi-turkiye-eaf-20220829T000000Z-30d",
    "model_id": "etas-mizrahi",
    "n_simulations": 1000,
    "n_target_events": 1,
    "notes": "{\"seed\": 20220101, \"target_filter\": {\"below_threshold\": 0, \"given\": 3, \"no_mw\": 2, \"not_earthquake\": 0, \"outside_grid\": 0, \"used\": 1}}",
    "p_value": null,
    "passed": true,
    "quantile": 0.18,
    "quantile_high": null,
    "quantile_low": null,
    "statistic": -9.965181221198467,
    "target_catalog_hash": "6ae73920d22883505cc072fe1457ad64c4e1e0787671438b943ba2b73fb7cf26",
    "target_window_end": "2022-09-28T00:00:00Z",
    "target_window_start": "2022-08-29T00:00:00Z",
    "test_name": "L"
  },
  {
    "alpha": 0.05,
    "benchmark_model_id": null,
    "evaluated_at": "2026-09-03T17:16:25.818507Z",
    "evaluator_version": "pycsep-0.8.0",
    "forecast_id": "etas-mizrahi-turkiye-eaf-20220829T000000Z-30d",
    "model_id": "etas-mizrahi",
    "n_simulations": 1000,
    "n_target_events": 1,
    "notes": "{\"seed\": 20220101, \"target_filter\": {\"below_threshold\": 0, \"given\": 3, \"no_mw\": 2, \"not_earthquake\": 0, \"outside_grid\": 0, \"used\": 1}}",
    "p_value": null,
    "passed": true,
    "quantile": 0.405,
    "quantile_high": null,
    "quantile_low": null,
    "statistic": -9.965181221198467,
    "target_catalog_hash": "6ae73920d22883505cc072fe1457ad64c4e1e0787671438b943ba2b73fb7cf26",
    "target_window_end": "2022-09-28T00:00:00Z",
    "target_window_start": "2022-08-29T00:00:00Z",
    "test_name": "CL"
  }
]
